"Key","Swedish","English UK","English US","Context","Status","Translator","Last Modified","Notes"
"size_guide_link","Storleksguide","Size Guide","Size Guide","B2C product page - size guide link","Complete","","","Link text for size guide modal"
"size_guide_modal_title","Storleksguide","Size Guide","Size Guide","B2C product page - modal title","Complete","","","Title for size guide modal"
"size_guide_modal_close","Stäng","Close","Close","B2C product page - modal close","Complete","","","Close button for size guide modal"
"size_and_fit_section","Storlek och passform","Size and Fit","Size and Fit","B2C product page - expandable section","Complete","","","Size and fit section header"
"shipping_returns_section","Fri frakt och fri retur","Free Shipping and Returns","Free Shipping and Returns","B2C product page - expandable section","Complete","","","Shipping and returns section header"
"how_its_made_section","Hur den tillverkades","How It's Made","How It's Made","B2C product page - expandable section","Complete","","","How it's made section header"
"no_group_content","Ingen information tillgänglig","No information available","No information available","B2C product page - fallback text","Complete","","","Fallback when no group content exists"
"loading_group_content","Laddar information...","Loading information...","Loading information...","B2C product page - loading state","Complete","","","Loading state for group content"
"product_reviews_section","Recensioner","Reviews","Reviews","B2C product page - reviews section","Complete","","","Reviews section header on product page"
"product_reviews_section_with_count","Recensioner ({{count}})","Reviews ({{count}})","Reviews ({{count}})","B2C product page - reviews section with count","Complete","","","Reviews section header with dynamic count on product page"
"error_loading_products","Kunde inte ladda produkter","Could not load products","Could not load products","B2C storefront - error message","Pending","","","Error toast when product loading fails"
"product_added_to_cart","{{name}} tillagd i varukorgen!","{{name}} added to cart!","{{name}} added to cart!","B2C storefront - success message","Pending","","","Success toast when adding product to cart"
"product_description_fallback","B8Shield {{color}} - Vasskydd som förhindrar att dina fiskedrag fastnar","B8Shield {{color}} - Weed guard that prevents your lures from getting stuck","B8Shield {{color}} - Weed guard that prevents your lures from getting stuck","B2C storefront - product description fallback","Pending","","","Fallback description for products without B2C description"
"hero_innovation_badge","Ny innovation från Sverige","New innovation from Sweden","New innovation from Sweden","B2C storefront - hero section badge","Pending","","","Innovation badge in hero section"
"hero_title_start","Fastna","Get stuck","Get stuck","B2C storefront - hero title first part","Pending","","","First part of hero title"
"hero_title_middle","aldrig","never","never","B2C storefront - hero title middle part","Pending","","","Middle part of hero title (highlighted)"
"hero_title_end","mer!","again!","again!","B2C storefront - hero title end part","Pending","","","End part of hero title"
"hero_subtitle","B8Shield™ – Vasskydd som förhindrar att dina fiskedrag fastnar i vassen utan att påverka ditt fiske.","B8Shield™ – Weed guard that prevents your lures from getting stuck in weeds without affecting your fishing.","B8Shield™ – Weed guard that prevents your lures from getting stuck in weeds without affecting your fishing.","B2C storefront - hero subtitle","Pending","","","Main hero subtitle description"
"hero_shop_now_button","Handla nu","Shop now","Shop now","B2C storefront - hero primary button","Pending","","","Primary call-to-action button in hero"
"hero_read_more_button","Läs mer","Read more","Read more","B2C storefront - hero secondary button","Pending","","","Secondary button in hero"
"products_section_title","Våra Produkter","Our Products","Our Products","B2C storefront - products section title","Pending","","","Products section main heading"
"products_section_subtitle","Välj mellan olika färger och storlekar för att passa ditt fiske","Choose from different colours and sizes to suit your fishing","Choose from different colors and sizes to suit your fishing","B2C storefront - products section subtitle","Pending","","","Products section description"
"sustainable_materials_badge","Hållbara material","Sustainable materials","Sustainable materials","B2C storefront - product badge","Pending","","","Badge on product cards indicating sustainability"
"product_name_3pack","B8Shield 3-pack","B8Shield 3-pack","B8Shield 3-pack","B2C storefront - 3-pack product name","Pending","","","Name for 3-pack products"
"product_description_3pack","Vasskydd 3-pack för olika fiskemiljöer","Weed guard 3-pack for different fishing environments","Weed guard 3-pack for different fishing environments","B2C storefront - 3-pack description","Pending","","","Description for 3-pack products"
"product_3pack_info","Innehåller alla storlekar (2mm, 4mm, 6mm) • {{count}} färger","Includes all sizes (2mm, 4mm, 6mm) • {{count}} colours","Includes all sizes (2mm, 4mm, 6mm) • {{count}} colors","B2C storefront - 3-pack variant info","Pending","","","Information about 3-pack contents and colours"
"product_name_individual","B8Shield {{color}}","B8Shield {{color}}","B8Shield {{color}}","B2C storefront - individual product name","Pending","","","Name template for individual products"
"product_description_individual","Vasskydd som förhindrar fastnade fiskedrag","Weed guard that prevents stuck lures","Weed guard that prevents stuck lures","B2C storefront - individual product description","Pending","","","Description for individual products"
"product_multiple_sizes","{{count}} storlekar","{{count}} sizes","{{count}} sizes","B2C storefront - size variants info","Pending","","","Text for products with multiple sizes"
"product_single_size","1 storlek","1 size","1 size","B2C storefront - single size info","Pending","","","Text for products with single size"
"no_products_available","Inga produkter tillgängliga för tillfället.","No products available at the moment.","No products available at the moment.","B2C storefront - empty state","Pending","","","Message when no products are found"
"features_section_title","Varför välja B8Shield™?","Why choose B8Shield™?","Why choose B8Shield™?","B2C storefront - features section title","Pending","","","Features section main heading"
"feature_proven_effective_title","Bevisat Effektivt","Proven Effective","Proven Effective","B2C storefront - feature 1 title","Pending","","","First feature title"
"feature_proven_effective_description","Minska förlusten av beten med upp till 90% enligt våra tester","Reduce lure loss by up to 90% according to our tests","Reduce lure loss by up to 90% according to our tests","B2C storefront - feature 1 description","Pending","","","First feature description"
"feature_easy_to_use_title","Enkelt att Använda","Easy to Use","Easy to Use","B2C storefront - feature 2 title","Pending","","","Second feature title"
"feature_easy_to_use_description","Fäst enkelt på ditt fiskedrag på några sekunder","Attach easily to your lure in seconds","Attach easily to your lure in seconds","B2C storefront - feature 2 description","Pending","","","Second feature description"
"feature_eco_friendly_title","Miljövänligt","Eco-Friendly","Eco-Friendly","B2C storefront - feature 3 title","Pending","","","Third feature title"
"feature_eco_friendly_description","Återvinningsbart material som skyddar våra vattenmiljöer","Recyclable material that protects our aquatic environments","Recyclable material that protects our aquatic environments","B2C storefront - feature 3 description","Pending","","","Third feature description"
"reviews_section_title","Vad våra kunder säger","What our customers say","What our customers say","B2C storefront - reviews section title","Pending","","","Reviews section main heading"
"reviews_section_subtitle","Äkta recensioner från nöjda sportfiskare","Genuine reviews from satisfied sport fishermen","Genuine reviews from satisfied sport fishermen","B2C storefront - reviews section subtitle","Pending","","","Reviews section description"
"product_not_found","Produkten hittades inte","Product not found","Product not found","B2C product page - error message","Pending","","","Error message when product cannot be found"
"error_loading_product","Kunde inte ladda produkten","Could not load product","Could not load product","B2C product page - error message","Pending","","","Error message when product loading fails"
"please_select_color","Vänligen välj en färg","Please select a colour","Please select a color","B2C product page - validation message","Pending","","","Validation for multipack colour selection"
"please_select_size","Vänligen välj en storlek","Please select a size","Please select a size","B2C product page - validation message","Pending","","","Validation for size selection"
"invalid_color_selected","Ogiltig färg vald","Invalid colour selected","Invalid color selected","B2C product page - error message","Pending","","","Error for invalid colour selection"
"invalid_size_selected","Ogiltig storlek vald","Invalid size selected","Invalid size selected","B2C product page - error message","Pending","","","Error for invalid size selection"
"product_added_to_cart_product_page","Produkt tillagd i varukorgen","Product added to cart","Product added to cart","B2C product page - success message","Pending","","","Success message on product page when adding to cart"
"product_not_found_page_title","Produkten hittades inte","Product not found","Product not found","B2C product page - page title","Pending","","","Page title for 404 product page"
"back_to_shop_button","Tillbaka till butiken","Back to shop","Back to shop","B2C product page - navigation button","Pending","","","Button to return to main shop"
"select_color","Välj färg","Select colour","Select color","B2C product page - selection header","Pending","","","Header for colour selection section"
"select_size","Välj storlek","Select size","Select size","B2C product page - selection header","Pending","","","Header for size selection section"
"add_to_shopping_bag","Lägg i shoppingbagen","Add to shopping bag","Add to shopping bag","B2C product page - main CTA button","Pending","","","Primary add to cart button"
"favorite_button","Favorit ♡","Favourite ♡","Favorite ♡","B2C product page - secondary button","Pending","","","Favourite/wishlist button"
"klarna_available_at_checkout","är tillgängligt i kassan.","is available at checkout.","is available at checkout.","B2C product page - payment info","Pending","","","Klarna payment information"
"click_and_collect_available","Tillgängligt för Click and Collect i kassan","Available for Click and Collect at checkout","Available for Click and Collect at checkout","B2C product page - collection info","Pending","","","Click and collect information"
"show_product_information","Visa produktinformation","Show product information","Show product information","B2C product page - section header","Pending","","","Header for product details section"
"product_detailed_description","B8Shield {{color}} i storlek {{size}} ger dig det ultimata skyddet för dina fiskedrag. Denna högkvalitativa produkt är utvecklad för att hålla i många år av intensivt fiske, oavsett väderförhållanden. Perfekt för både nybörjare och erfarna fiskare som vill skydda sina värdefulla fiskedrag från skador.","B8Shield {{color}} in size {{size}} gives you the ultimate protection for your lures. This high-quality product is designed to last for many years of intensive fishing, regardless of weather conditions. Perfect for both beginners and experienced anglers who want to protect their valuable lures from damage.","B8Shield {{color}} in size {{size}} gives you the ultimate protection for your lures. This high-quality product is designed to last for many years of intensive fishing, regardless of weather conditions. Perfect for both beginners and experienced anglers who want to protect their valuable lures from damage.","B2C product page - detailed description","Pending","","","Detailed product description fallback"
"product_color_shown","Färg som visas: {{color}}","Colour shown: {{color}}","Color shown: {{color}}","B2C product page - specification","Pending","","","Product specification for colour"
"product_size_spec","Storlek: {{size}}","Size: {{size}}","Size: {{size}}","B2C product page - specification","Pending","","","Product specification for size"
"product_style_spec","Stil: {{sku}}","Style: {{sku}}","Style: {{sku}}","B2C product page - specification","Pending","","","Product specification for style/SKU"
"more_product_information","Mer produktinformation","More product information","More product information","B2C product page - expandable section","Pending","","","Header for additional product information section"
"product_transparent_name","B8Shield Transparent","B8Shield Transparent","B8Shield Transparent","B2C affiliate portal - product name","Pending","","","Transparent product name for affiliate portal"
"product_transparent_description","Diskret vasskydd för klart vatten","Discreet weed guard for clear water","Discreet weed guard for clear water","B2C affiliate portal - product description","Pending","","","Transparent product description for affiliate portal"
"product_red_name","B8Shield Röd","B8Shield Red","B8Shield Red","B2C affiliate portal - product name","Pending","","","Red product name for affiliate portal"
"product_red_description","Vasskydd för mörkt vatten","Weed guard for dark water","Weed guard for dark water","B2C affiliate portal - product description","Pending","","","Red product description for affiliate portal"
"product_fluorescent_name","B8Shield Fluorescerande","B8Shield Fluorescent","B8Shield Fluorescent","B2C affiliate portal - product name","Pending","","","Fluorescent product name for affiliate portal"
"product_fluorescent_description","Vasskydd för djupt vatten","Weed guard for deep water","Weed guard for deep water","B2C affiliate portal - product description","Pending","","","Fluorescent product description for affiliate portal"
"product_glitter_name","B8Shield Glitter","B8Shield Glitter","B8Shield Glitter","B2C affiliate portal - product name","Pending","","","Glitter product name for affiliate portal"
"product_glitter_description","Vasskydd för extra synlighet","Weed guard for extra visibility","Weed guard for extra visibility","B2C affiliate portal - product description","Pending","","","Glitter product description for affiliate portal"
"product_3pack_name","B8Shield 3-pack","B8Shield 3-pack","B8Shield 3-pack","B2C affiliate portal - product name","Pending","","","3-pack product name for affiliate portal"
"product_3pack_description","Komplett startpaket med alla storlekar","Complete starter package with all sizes","Complete starter package with all sizes","B2C affiliate portal - product description","Pending","","","3-pack product description for affiliate portal"
"error_generating_qr","Kunde inte generera QR-kod","Could not generate QR code","Could not generate QR code","B2C affiliate portal - error message","Pending","","","Error message for QR code generation failure"
"link_copied","Länk kopierad!","Link copied!","Link copied!","B2C affiliate portal - success message","Pending","","","Success message when link is copied to clipboard"
"error_copying_link","Kunde inte kopiera länk","Could not copy link","Could not copy link","B2C affiliate portal - error message","Pending","","","Error message when link copying fails"
"qr_downloaded","QR-kod nedladdad!","QR code downloaded!","QR code downloaded!","B2C affiliate portal - success message","Pending","","","Success message when QR code is downloaded"
"not_approved_affiliate","Du är inte en godkänd affiliate. Ansök idag!","You are not an approved affiliate. Apply today!","You are not an approved affiliate. Apply today!","B2C affiliate portal - error message","Pending","","","Error message for unapproved affiliate"
"error_loading_affiliate_data","Kunde inte ladda affiliate-data. Försök igen senare.","Could not load affiliate data. Please try again later.","Could not load affiliate data. Please try again later.","B2C affiliate portal - error message","Pending","","","Error message when affiliate data loading fails"
"loading_portal","Laddar portal...","Loading portal...","Loading portal...","B2C affiliate portal - loading message","Pending","","","Loading message for affiliate portal"
"affiliate_portal_title","Affiliate Portal","Affiliate Portal","Affiliate Portal","B2C affiliate portal - page title","Pending","","","Main title for affiliate portal page"
"please_login_to_see_dashboard","Vänligen logga in för att se din instrumentpanel.","Please log in to see your dashboard.","Please log in to see your dashboard.","B2C affiliate portal - login prompt","Pending","","","Login prompt message for affiliate portal"
"not_affiliate_yet","Inte en affiliate än?","Not an affiliate yet?","Not an affiliate yet?","B2C affiliate portal - registration prompt","Pending","","","Prompt for affiliate registration"
"apply_here","Ansök här!","Apply here!","Apply here!","B2C affiliate portal - registration link","Pending","","","Link text for affiliate registration"
"no_access","Ingen åtkomst","No access","No access","B2C affiliate portal - error title","Pending","","","Error title for access denied"
"no_active_affiliate_account","Vi kunde inte hitta ett aktivt affiliate-konto kopplat till din e-post.","We could not find an active affiliate account linked to your email.","We could not find an active affiliate account linked to your email.","B2C affiliate portal - error message","Pending","","","Error message for no active affiliate account"
"approval_delay_notice","Observera: Det kan ta några minuter efter godkännande innan portalen blir aktiv.","Note: It may take a few minutes after approval before the portal becomes active.","Note: It may take a few minutes after approval before the portal becomes active.","B2C affiliate portal - notice","Pending","","","Notice about approval delay"
"apply_to_become_affiliate","Ansök för att bli Affiliate","Apply to become an Affiliate","Apply to become an Affiliate","B2C affiliate portal - application button","Pending","","","Button text for affiliate application"
"welcome_affiliate","Välkommen, {{name}}!","Welcome, {{name}}!","Welcome, {{name}}!","B2C affiliate portal - welcome message","Pending","","","Welcome message with affiliate name"
"unique_affiliate_link","Din unika affiliatelänk","Your unique affiliate link","Your unique affiliate link","B2C affiliate portal - section title","Pending","","","Title for affiliate link section"
"share_link_earn_commission","Dela denna länk för att spåra klick och tjäna provision. Alla köp som görs via din länk ger dig {{rate}}% i provision.","Share this link to track clicks and earn commission. All purchases made via your link give you {{rate}}% commission.","Share this link to track clicks and earn commission. All purchases made via your link give you {{rate}}% commission.","B2C affiliate portal - instruction text","Pending","","","Instructions for using affiliate link"
"copy_button","Kopiera","Copy","Copy","B2C affiliate portal - button text","Pending","","","Copy button text"
"marketing_materials","Marknadsföringsmaterial","Marketing Materials","Marketing Materials","B2C affiliate portal - section title","Pending","","","Title for marketing materials section"
"marketing_materials_description","Ladda ner bilder, banners och annonser för att marknadsföra B8Shield effektivt.","Download images, banners and adverts to market B8Shield effectively.","Download images, banners and ads to market B8Shield effectively.","B2C affiliate portal - description","Pending","","","Description for marketing materials section"
"your_statistics","Din Statistik","Your Statistics","Your Statistics","B2C affiliate portal - section title","Pending","","","Title for statistics section"
"clicks_30_days","Klick (30 dagar)","Clicks (30 days)","Clicks (30 days)","B2C affiliate portal - statistic label","Pending","","","Label for clicks statistics"
"conversions_30_days","Konverteringar (30 dagar)","Conversions (30 days)","Conversions (30 days)","B2C affiliate portal - statistic label","Pending","","","Label for conversions statistics"
"unpaid_commission","Obetald Provision","Unpaid Commission","Unpaid Commission","B2C affiliate portal - statistic label","Pending","","","Label for unpaid commission"
"total_earnings","Totala Intäkter","Total Earnings","Total Earnings","B2C affiliate portal - statistic label","Pending","","","Label for total earnings"
"request_payout","Begär utbetalning","Request payout","Request payout","B2C affiliate portal - button text","Pending","","","Button text for requesting payout"
"cart_breadcrumb","Varukorg","Shopping Cart","Shopping Cart","B2C shopping cart - breadcrumb","Pending","","","Breadcrumb navigation for shopping cart"
"your_cart_title","Din Varukorg","Your Shopping Cart","Your Shopping Cart","B2C shopping cart - page title","Pending","","","Main page title for shopping cart"
"cart_is_empty_heading","Din varukorg är tom","Your cart is empty","Your cart is empty","B2C shopping cart - empty state title","Pending","","","Title when cart has no items"
"cart_empty_description","Utforska våra produkter och lägg till något i din varukorg.","Explore our products and add something to your cart.","Explore our products and add something to your cart.","B2C shopping cart - empty state description","Pending","","","Description when cart has no items"
"continue_shopping","Fortsätt handla","Continue shopping","Continue shopping","B2C shopping cart - navigation button","Pending","","","Button to return to shopping"
"size_label","Storlek: {{size}}","Size: {{size}}","Size: {{size}}","B2C shopping cart - product size","Pending","","","Size label for cart items"
"shipping_country","Leveransland","Shipping country","Shipping country","B2C shopping cart - section title","Pending","","","Title for shipping country selection"
"nordic_countries","Norden","Nordic","Nordic","B2C shopping cart - country group","Pending","","","Label for Nordic countries group"
"country_sweden","Sverige","Sweden","Sweden","B2C shopping cart - country name","Pending","","","Sweden country name"
"country_norway","Norge","Norway","Norway","B2C shopping cart - country name","Pending","","","Norway country name"
"country_denmark","Danmark","Denmark","Denmark","B2C shopping cart - country name","Pending","","","Denmark country name"
"country_finland","Finland","Finland","Finland","B2C shopping cart - country name","Pending","","","Finland country name"
"country_iceland","Island","Iceland","Iceland","B2C shopping cart - country name","Pending","","","Iceland country name"
"country_other","Övriga länder","Other countries","Other countries","B2C shopping cart - country name","Pending","","","Other countries option"
"other_countries_group","Övriga","Other","Other","B2C shopping cart - country group","Pending","","","Label for other countries group"
"discount_code","Rabattkod","Discount code","Discount code","B2C shopping cart - section title","Pending","","","Title for discount code section"
"enter_your_code","Ange din kod","Enter your code","Enter your code","B2C shopping cart - input placeholder","Pending","","","Placeholder for discount code input"
"apply_button","Applicera","Apply","Apply","B2C shopping cart - button text","Pending","","","Apply discount code button"
"order_summary","Ordersammanfattning","Order summary","Order summary","B2C shopping cart - section title","Pending","","","Title for order summary section"
"subtotal","Delsumma","Subtotal","Subtotal","B2C shopping cart - price label","Pending","","","Subtotal label in order summary"
"affiliate_discount_label","Affiliate rabatt, {{percentage}}%","Affiliate discount, {{percentage}}%","Affiliate discount, {{percentage}}%","B2C shopping cart - discount badge","Pending","","","Affiliate discount badge with percentage"
"shipping_cost_label","Frakt ({{country}})","Shipping ({{country}})","Shipping ({{country}})","B2C shopping cart - shipping label","Pending","","","Shipping cost label with country"
"total","Totalt","Total","Total","B2C shopping cart - price label","Pending","","","Total price label"
"vat_included","Varav Moms (25%) {{amount}}","Including VAT (25%) {{amount}}","Including VAT (25%) {{amount}}","B2C shopping cart - tax information","Pending","","","VAT information with amount"
"go_to_checkout","Gå till kassan","Go to checkout","Go to checkout","B2C shopping cart - main CTA button","Pending","","","Primary checkout button"
"or_continue_shopping","eller fortsätt handla","or continue shopping","or continue shopping","B2C shopping cart - alternative action","Pending","","","Alternative action link"
"product_removed_from_cart","Produkt borttagen från varukorgen","Product removed from cart","Product removed from cart","B2C shopping cart - success message","Pending","","","Success message when product is removed"
"please_enter_discount_code","Vänligen ange en rabattkod.","Please enter a discount code.","Please enter a discount code.","B2C shopping cart - validation message","Pending","","","Validation message for empty discount code"
"cart_is_empty","Din varukorg är tom","Your cart is empty","Your cart is empty","B2C shopping cart - error message","Pending","","","Error message when trying to checkout with empty cart"
"checkout_invalid_email","Vänligen ange en giltig e-postadress.","Please enter a valid email address.","Please enter a valid email address.","B2C checkout - validation error","Pending","","","Email validation error message"
