"Key","Swedish","English UK","English US","Context","Status","Translator","Last Modified","Notes"
"checkout_missing_fields","Vänligen fyll i alla obligatoriska fält.","Please fill in all required fields.","Please fill in all required fields.","B2C checkout - validation error","Pending","","","Required fields validation error"
"checkout_empty_cart","Din varukorg är tom.","Your cart is empty.","Your cart is empty.","B2C checkout - error message","Pending","","","Cart empty error message"
"checkout_placing_order","Lägger din beställning...","Placing your order...","Placing your order...","B2C checkout - loading message","Pending","","","Loading state when placing order"
"checkout_background_error","Ett bakgrundsfel inträffade. Din order har tagits emot, men kontakta support om du inte får en bekräftelse.","A background error occurred. Your order has been received, but contact support if you don't receive a confirmation.","A background error occurred. Your order has been received, but contact support if you don't receive a confirmation.","B2C checkout - error message","Pending","","","Background processing error message"
"checkout_order_success","Tack för din beställning! Ordernummer: {{orderNumber}}","Thank you for your order! Order number: {{orderNumber}}","Thank you for your order! Order number: {{orderNumber}}","B2C checkout - success message","Pending","","","Order success message with order number"
"checkout_error","Ett fel uppstod vid beställningen. Försök igen.","An error occurred while placing your order. Please try again.","An error occurred while placing your order. Please try again.","B2C checkout - error message","Pending","","","General order error message"
"checkout_empty_cart_title","Din varukorg är tom","Your cart is empty","Your cart is empty","B2C checkout - empty state title","Pending","","","Title when cart is empty"
"checkout_empty_cart_description","Lägg till produkter i din varukorg för att fortsätta till kassan.","Add products to your cart to proceed to checkout.","Add products to your cart to proceed to checkout.","B2C checkout - empty state description","Pending","","","Description when cart is empty"
"checkout_continue_shopping","Fortsätt handla","Continue shopping","Continue shopping","B2C checkout - button text","Pending","","","Continue shopping button text"
"checkout_back_to_cart","Tillbaka till varukorg","Back to cart","Back to cart","B2C checkout - navigation","Pending","","","Back to cart link text"
"checkout_secure_checkout","Säker kassa","Secure checkout","Secure checkout","B2C checkout - security indicator","Pending","","","Secure checkout indicator text"
"checkout_step_contact","Kontakt","Contact","Contact","B2C checkout - step label","Pending","","","Contact step label"
"checkout_step_shipping","Leverans","Shipping","Shipping","B2C checkout - step label","Pending","","","Shipping step label"
"checkout_step_payment","Betalning","Payment","Payment","B2C checkout - step label","Pending","","","Payment step label"
"checkout_contact_info","Kontaktinformation","Contact Information","Contact Information","B2C checkout - section title","Pending","","","Contact information section title"
"checkout_email_label","E-postadress *","Email address *","Email address *","B2C checkout - form label","Pending","","","Email field label"
"checkout_email_placeholder","din@epost.se","your@email.com","your@email.com","B2C checkout - form placeholder","Pending","","","Email field placeholder"
"checkout_marketing_opt_in","Skicka mig nyheter och erbjudanden via e-post","Send me news and offers via email","Send me news and offers via email","B2C checkout - marketing opt-in","Pending","","","Marketing opt-in checkbox label"
"checkout_continue_shipping","Fortsätt till leveransadress","Continue to shipping address","Continue to shipping address","B2C checkout - button text","Pending","","","Continue to shipping step button"
"checkout_shipping_address","Leveransadress","Shipping Address","Shipping Address","B2C checkout - section title","Pending","","","Shipping address section title"
"checkout_change","Ändra","Change","Change","B2C checkout - button text","Pending","","","Change button text"
"checkout_contact_label","Kontakt","Contact","Contact","B2C checkout - label","Pending","","","Contact info label"
"checkout_first_name","Förnamn *","First name *","First name *","B2C checkout - form label","Pending","","","First name field label"
"checkout_last_name","Efternamn *","Last name *","Last name *","B2C checkout - form label","Pending","","","Last name field label"
"checkout_address","Adress *","Address *","Address *","B2C checkout - form label","Pending","","","Address field label"
"checkout_address_placeholder","Gatuadress","Street address","Street address","B2C checkout - form placeholder","Pending","","","Address field placeholder"
"checkout_apartment","Lägenhet, svit, etc. (valfritt)","Apartment, suite, etc. (optional)","Apartment, suite, etc. (optional)","B2C checkout - form label","Pending","","","Apartment field label"
"checkout_apartment_placeholder","Lägenhetsnummer, våning, etc.","Apartment number, floor, etc.","Apartment number, floor, etc.","B2C checkout - form placeholder","Pending","","","Apartment field placeholder"
"checkout_postal_code","Postnummer *","Postal code *","Postal code *","B2C checkout - form label","Pending","","","Postal code field label"
"checkout_postal_code_placeholder","123 45","12345","12345","B2C checkout - form placeholder","Pending","","","Postal code field placeholder"
"checkout_city","Stad *","City *","City *","B2C checkout - form label","Pending","","","City field label"
"checkout_city_placeholder","Stockholm","London","New York","B2C checkout - form placeholder","Pending","","","City field placeholder"
"checkout_country","Land *","Country *","Country *","B2C checkout - form label","Pending","","","Country field label"
"checkout_country_sweden","Sverige","Sweden","Sweden","B2C checkout - country option","Pending","","","Sweden country option"
"checkout_country_norway","Norge","Norway","Norway","B2C checkout - country option","Pending","","","Norway country option"
"checkout_country_denmark","Danmark","Denmark","Denmark","B2C checkout - country option","Pending","","","Denmark country option"
"checkout_country_finland","Finland","Finland","Finland","B2C checkout - country option","Pending","","","Finland country option"
"checkout_country_germany","Tyskland","Germany","Germany","B2C checkout - country option","Pending","","","Germany country option"
"checkout_country_usa","USA","USA","USA","B2C checkout - country option","Pending","","","USA country option"
"checkout_continue_payment","Fortsätt till betalning","Continue to payment","Continue to payment","B2C checkout - button text","Pending","","","Continue to payment step button"
"checkout_payment_title","Betalning","Payment","Payment","B2C checkout - section title","Pending","","","Payment section title"
"checkout_delivery_to","Levereras till","Delivery to","Delivery to","B2C checkout - label","Pending","","","Delivery address label"
"checkout_payment_method","Betalningsmetod","Payment method","Payment method","B2C checkout - section title","Pending","","","Payment method section title"
"checkout_quick_checkout","Alternativ för snabb utcheckning","Quick checkout options","Quick checkout options","B2C checkout - label","Pending","","","Quick checkout options label"
"checkout_or","ELLER","OR","OR","B2C checkout - separator","Pending","","","OR separator text"
"checkout_dev_mode","🚧 Utvecklingsläge","🚧 Development mode","🚧 Development mode","B2C checkout - dev notice","Pending","","","Development mode notice"
"checkout_dev_description","Betalningsintegrationen (Stripe/Klarna/Swish) implementeras i nästa fas. Denna testorder skapas utan betalning för att testa affiliate-spårning.","Payment integration (Stripe/Klarna/Swish) will be implemented in the next phase. This test order is created without payment to test affiliate tracking.","Payment integration (Stripe/Klarna/Swish) will be implemented in the next phase. This test order is created without payment to test affiliate tracking.","B2C checkout - dev notice","Pending","","","Development mode description"
"checkout_processing","Bearbetar beställning...","Processing order...","Processing order...","B2C checkout - loading state","Pending","","","Order processing loading state"
"checkout_complete_order","Slutför beställning (Test)","Complete order (Test)","Complete order (Test)","B2C checkout - button text","Pending","","","Complete order button text"
"checkout_terms_agreement","Genom att slutföra beställningen godkänner du våra","By completing the order you agree to our","By completing the order you agree to our","B2C checkout - terms agreement","Pending","","","Terms agreement text part 1"
"checkout_terms_link","villkor","terms","terms","B2C checkout - terms link","Pending","","","Terms link text"
"checkout_terms_and","och","and","and","B2C checkout - conjunction","Pending","","","And conjunction"
"checkout_privacy_link","integritetspolicy","privacy policy","privacy policy","B2C checkout - privacy link","Pending","","","Privacy policy link text"
"checkout_order_summary","Ordersammanfattning","Order Summary","Order Summary","B2C checkout - section title","Pending","","","Order summary section title"
"checkout_standard_variant","Standard","Standard","Standard","B2C checkout - product variant","Pending","","","Standard product variant"
"checkout_subtotal","Delsumma","Subtotal","Subtotal","B2C checkout - price breakdown","Pending","","","Subtotal label"
"checkout_affiliate_discount","Affiliate rabatt, {{discountPercentage}}%","Affiliate discount, {{discountPercentage}}%","Affiliate discount, {{discountPercentage}}%","B2C checkout - discount label","Pending","","","Affiliate discount label with percentage"
"checkout_shipping","Frakt ({{shippingCountry}})","Shipping ({{shippingCountry}})","Shipping ({{shippingCountry}})","B2C checkout - shipping label","Pending","","","Shipping label with country"
"checkout_total","Totalt","Total","Total","B2C checkout - price breakdown","Pending","","","Total label"
"checkout_vat","Varav Moms (25%)","VAT included (25%)","VAT included (25%)","B2C checkout - tax info","Pending","","","VAT information"
"checkout_affiliate_activated","🎉 Affiliate-rabatt aktiverad!","🎉 Affiliate discount activated!","🎉 Affiliate discount activated!","B2C checkout - success message","Pending","","","Affiliate discount activation message"
"checkout_affiliate_code","Kod: {{code}} • {{discountPercentage}}% rabatt","Code: {{code}} • {{discountPercentage}}% discount","Code: {{code}} • {{discountPercentage}}% discount","B2C checkout - affiliate info","Pending","","","Affiliate code and discount display"
"order_confirmation_no_id","Ingen order ID hittades.","No order ID found.","No order ID found.","B2C order confirmation - error message","Pending","","","Error when no order ID is provided"
"order_confirmation_not_found","Kunde inte hitta din beställning.","Could not find your order.","Could not find your order.","B2C order confirmation - error message","Pending","","","Error when order document doesn't exist"
"order_confirmation_fetch_error","Ett fel uppstod när din beställning skulle hämtas.","An error occurred while fetching your order.","An error occurred while fetching your order.","B2C order confirmation - error message","Pending","","","Error when order fetching fails"
"order_confirmation_processing","Bearbetar...","Processing...","Processing...","B2C order confirmation - fallback text","Pending","","","Fallback text when date is not available"
"order_confirmation_loading","Laddar orderbekräftelse...","Loading order confirmation...","Loading order confirmation...","B2C order confirmation - loading state","Pending","","","Loading message for order confirmation"
"order_confirmation_not_found_title","Order hittades inte","Order not found","Order not found","B2C order confirmation - error title","Pending","","","Title when order is not found"
"order_confirmation_not_found_description","Vi kunde inte hitta den begärda ordern.","We could not find the requested order.","We could not find the requested order.","B2C order confirmation - error description","Pending","","","Description when order is not found"
"order_confirmation_back_to_shop","Tillbaka till butiken","Back to shop","Back to shop","B2C order confirmation - navigation button","Pending","","","Button to return to shop"
"order_confirmation_thank_you","Tack för din beställning!","Thank you for your order!","Thank you for your order!","B2C order confirmation - main title","Pending","","","Main thank you title"
"variant_count_badge","{{count}} varianter","{{count}} variants","{{count}} variants","B2C storefront - product variant badge","Pending","","","Badge showing number of variants available"
"product_name_fallback","B8Shield {{group}}","B8Shield {{group}}","B8Shield {{group}}","B2C storefront - product name fallback","Pending","","","Fallback product name using group name"
"product_group_variants","{{count}} färger och storlekar","{{count}} colours and sizes","{{count}} colors and sizes","B2C storefront - group variant info","Pending","","","Text showing number of color and size variants in group"
"product_single_variant","En variant tillgänglig","One variant available","One variant available","B2C storefront - single variant info","Pending","","","Text for products with only one variant"
"order_confirmation_received","Din beställning har tagits emot och kommer att behandlas inom kort.","Your order has been received and will be processed shortly.","Your order has been received and will be processed shortly.","B2C order confirmation - description","Pending","","","Order received description"
"order_confirmation_order_number","Ordernummer:","Order number:","Order number:","B2C order confirmation - label","Pending","","","Order number label"
"order_confirmation_ordered","Beställd:","Ordered:","Ordered:","B2C order confirmation - label","Pending","","","Order date label"
"order_confirmation_customer_info","Kunduppgifter","Customer Information","Customer Information","B2C order confirmation - section title","Pending","","","Customer information section title"
"order_confirmation_contact_info","Kontaktinformation","Contact Information","Contact Information","B2C order confirmation - subsection title","Pending","","","Contact information subsection title"
"order_confirmation_newsletter_subscription","✓ Prenumererar på nyhetsbrev","✓ Subscribed to newsletter","✓ Subscribed to newsletter","B2C order confirmation - subscription status","Pending","","","Newsletter subscription status"
"order_confirmation_shipping_address","Leveransadress","Shipping Address","Shipping Address","B2C order confirmation - subsection title","Pending","","","Shipping address subsection title"
"order_confirmation_order_contents","Orderinnehåll","Order Contents","Order Contents","B2C order confirmation - section title","Pending","","","Order contents section title"
"order_confirmation_quantity","Antal: {{quantity}}","Quantity: {{quantity}}","Quantity: {{quantity}}","B2C order confirmation - item quantity","Pending","","","Item quantity label with interpolation"
"order_confirmation_affiliate_applied","🎉 Affiliate-rabatt tillämpad","🎉 Affiliate discount applied","🎉 Affiliate discount applied","B2C order confirmation - affiliate section title","Pending","","","Affiliate discount applied section title"
"order_confirmation_affiliate_code","Affiliate-kod","Affiliate code","Affiliate code","B2C order confirmation - affiliate label","Pending","","","Affiliate code label"
"order_confirmation_discount","Rabatt","Discount","Discount","B2C order confirmation - discount label","Pending","","","Discount label"
"order_confirmation_tracking_status","Spårningsstatus:","Tracking status:","Tracking status:","B2C order confirmation - tracking label","Pending","","","Tracking status label"
"order_confirmation_affiliate_tracking_description","Denna beställning har registrerats för affiliate-provision. Affiliate-partnern kommer att få kredit för denna försäljning.","This order has been registered for affiliate commission. The affiliate partner will receive credit for this sale.","This order has been registered for affiliate commission. The affiliate partner will receive credit for this sale.","B2C order confirmation - affiliate tracking description","Pending","","","Affiliate tracking description"
"order_confirmation_next_steps","Nästa steg","Next Steps","Next Steps","B2C order confirmation - section title","Pending","","","Next steps section title"
"order_confirmation_email_confirmation","Orderbekräftelse via e-post","Order confirmation by email","Order confirmation by email","B2C order confirmation - step title","Pending","","","Email confirmation step title"
"order_confirmation_email_sent","En bekräftelse har skickats till {{email}}","A confirmation has been sent to {{email}}","A confirmation has been sent to {{email}}","B2C order confirmation - email sent message","Pending","","","Email sent confirmation with email interpolation"
"order_confirmation_shipping_updates","Leveransuppdateringar","Shipping Updates","Shipping Updates","B2C order confirmation - step title","Pending","","","Shipping updates step title"
"order_confirmation_shipping_updates_description","Du kommer att få uppdateringar när din beställning skickas","You will receive updates when your order is shipped","You will receive updates when your order is shipped","B2C order confirmation - shipping description","Pending","","","Shipping updates description"
"order_confirmation_order_summary","Ordersammanfattning","Order Summary","Order Summary","B2C order confirmation - sidebar title","Pending","","","Order summary sidebar title"
"order_confirmation_subtotal","Delsumma","Subtotal","Subtotal","B2C order confirmation - price label","Pending","","","Subtotal label"
"order_confirmation_shipping","Frakt","Shipping","Shipping","B2C order confirmation - price label","Pending","","","Shipping cost label"
"order_confirmation_discount_with_code","Rabatt ({{affiliateCode}}) {{discountPercentage}}%","Discount ({{affiliateCode}}) {{discountPercentage}}%","Discount ({{affiliateCode}}) {{discountPercentage}}%","B2C order confirmation - discount with code","Pending","","","Discount with affiliate code and percentage"
"order_confirmation_vat","Moms (25%)","VAT (25%)","VAT (25%)","B2C order confirmation - tax label","Pending","","","VAT label"
"order_confirmation_total","Totalt","Total","Total","B2C order confirmation - total label","Pending","","","Total price label"
"order_confirmation_payment_status","Betalningsstatus","Payment Status","Payment Status","B2C order confirmation - payment section","Pending","","","Payment status section title"
"order_confirmation_payment_pending","Väntar på betalning (Test)","Awaiting payment (Test)","Awaiting payment (Test)","B2C order confirmation - payment status","Pending","","","Payment pending status"
"order_confirmation_continue_shopping","Fortsätt handla","Continue shopping","Continue shopping","B2C order confirmation - button text","Pending","","","Continue shopping button"
"order_confirmation_view_orders","Visa mina beställningar","View my orders","View my orders","B2C order confirmation - button text","Pending","","","View orders button"
"customer_login_success","Inloggad!","Logged in!","Logged in!","B2C customer login - success message","Pending","","","Success toast message after login"
"customer_login_error","Felaktig e-post eller lösenord. Kontrollera dina uppgifter och försök igen.","Invalid email or password. Please check your credentials and try again.","Invalid email or password. Please check your credentials and try again.","B2C customer login - error message","Pending","","","Error message for login failure"
"customer_login_title","Logga in på ditt konto","Log in to your account","Log in to your account","B2C customer login - main title","Pending","","","Main login page title"
"customer_login_or","Eller","Or","Or","B2C customer login - conjunction","Pending","","","Conjunction between login and register"
"customer_login_create_account","skapa ett nytt konto","create a new account","create a new account","B2C customer login - register link","Pending","","","Link text to registration page"
"customer_login_email_label","E-postadress","Email address","Email address","B2C customer login - form label","Pending","","","Email field label for screen readers"
"customer_login_email_placeholder","E-postadress","Email address","Email address","B2C customer login - form placeholder","Pending","","","Email field placeholder text"
"customer_login_password_label","Lösenord","Password","Password","B2C customer login - form label","Pending","","","Password field label for screen readers"
"customer_login_password_placeholder","Lösenord","Password","Password","B2C customer login - form placeholder","Pending","","","Password field placeholder text"
"customer_login_forgot_password","Glömt ditt lösenord?","Forgot your password?","Forgot your password?","B2C customer login - forgot password link","Pending","","","Forgot password link text"
"customer_login_loading","Loggar in...","Logging in...","Logging in...","B2C customer login - loading state","Pending","","","Loading state button text"
"customer_login_button","Logga in","Log in","Log in","B2C customer login - submit button","Pending","","","Submit button text"
"customer_login_back_to_shop","Tillbaka till butiken","Back to shop","Back to shop","B2C customer login - navigation link","Pending","","","Back to shop navigation link"
"customer_register_title","Skapa konto","Create account","Create account","B2C customer register - main title","Pending","","","Main registration page title"
"customer_register_coming_soon","Registrering kommer snart...","Registration coming soon...","Registration coming soon...","B2C customer register - placeholder message","Pending","","","Placeholder message for registration feature"
"customer_register_back_to_shop","Tillbaka till butiken","Back to shop","Back to shop","B2C customer register - navigation link","Pending","","","Back to shop navigation link"
"customer_register_already_have_account","Har redan konto? Logga in","Already have an account? Log in","Already have an account? Log in","B2C customer register - login link","Pending","","","Link to login page for existing users"
"customer_account_title","Mitt Konto","My Account","My Account","B2C customer account - main title","Pending","","","Main account page title"
"customer_account_coming_soon","Kontofunktioner kommer snart...","Account features coming soon...","Account features coming soon...","B2C customer account - placeholder message","Pending","","","Placeholder message for account features"
"customer_account_back_to_shop","Tillbaka till butiken","Back to shop","Back to shop","B2C customer account - navigation link","Pending","","","Back to shop navigation link"
"affiliate_reg_required_fields","Vänligen fyll i alla obligatoriska fält.","Please fill in all required fields.","Please fill in all required fields.","B2C affiliate registration - validation error","Pending","","","Required fields validation error"
"affiliate_reg_success","Tack för din ansökan! Vi återkommer inom kort.","Thank you for your application! We'll get back to you shortly.","Thank you for your application! We'll get back to you shortly.","B2C affiliate registration - success message","Pending","","","Application submission success message"
"affiliate_reg_error","Ett fel uppstod. Försök igen.","An error occurred. Please try again.","An error occurred. Please try again.","B2C affiliate registration - error message","Pending","","","General error message"
"affiliate_reg_title","Bli en B8Shield Partner","Become a B8Shield Partner","Become a B8Shield Partner","B2C affiliate registration - main title","Pending","","","Main page title"
"affiliate_reg_subtitle","Älskar du våra produkter? Gå med i vårt affiliate-program och tjäna provision genom att marknadsföra B8Shield till din publik.","Love our products? Join our affiliate programme and earn commission by promoting B8Shield to your audience.","Love our products? Join our affiliate program and earn commission by promoting B8Shield to your audience.","B2C affiliate registration - subtitle","Pending","","","Page subtitle description"
"affiliate_reg_basic_info","Grunduppgifter","Basic Information","Basic Information","B2C affiliate registration - section title","Pending","","","Basic information section header"
"affiliate_reg_full_name","Fullständigt Namn","Full Name","Full Name","B2C affiliate registration - form label","Pending","","","Full name field label"
"affiliate_reg_email","E-postadress","Email address","Email address","B2C affiliate registration - form label","Pending","","","Email field label"
"affiliate_reg_phone","Telefonnummer","Phone number","Phone number","B2C affiliate registration - form label","Pending","","","Phone field label"
"affiliate_reg_address_info","Adressuppgifter","Address Information","Address Information","B2C affiliate registration - section title","Pending","","","Address information section header"
"affiliate_reg_street_address","Gatuadress","Street address","Street address","B2C affiliate registration - form label","Pending","","","Street address field label"
"affiliate_reg_postal_code","Postnummer","Postal code","Postal code","B2C affiliate registration - form label","Pending","","","Postal code field label"
"affiliate_reg_city","Stad","City","City","B2C affiliate registration - form label","Pending","","","City field label"
"affiliate_reg_country","Land","Country","Country","B2C affiliate registration - form label","Pending","","","Country field label"
